{
  "protocol": "baijin-phase5-rollback-plan/1.0",
  "rollback_plan_id": "phase5-rollback-plan-ready-001",
  "phase": "phase5",
  "repository": "shunhang776/xinbaijin-mcp",
  "branch": "dev",
  "mode": "manual_ready",
  "rollback_ready": true,
  "rollback_scope": "full_l4_loop",
  "rollback_triggers": [
    "production_gate_misfire",
    "wrong_review_commit",
    "stale_review_bypassed",
    "branch_head_guard_bypassed",
    "repair_guard_bypassed",
    "artifact_integrity_failure",
    "operator_requested"
  ],
  "rollback_steps": [
    {
      "order": 1,
      "action": "Stop Phase5 production enforcer entrypoint.",
      "owner": "rollback_owner",
      "requires_manual_confirmation": true
    },
    {
      "order": 2,
      "action": "Switch enablement mode back to manual_gate.",
      "owner": "gate_owner",
      "requires_manual_confirmation": true
    },
    {
      "order": 3,
      "action": "Verify no production write action remains enabled.",
      "owner": "repository_owner",
      "requires_manual_confirmation": true
    }
  ],
  "verification_checks": [
    {
      "name": "phase5_mode",
      "expected": "mode is manual_gate or draft"
    },
    {
      "name": "production_enabled",
      "expected": "production_enabled is false"
    },
    {
      "name": "write_permissions",
      "expected": "no workflow has contents: write"
    }
  ],
  "owners": {
    "rollback_owner": "owner",
    "gate_owner": "owner",
    "repository_owner": "owner"
  },
  "approvals": {
    "rollback_owner_approved": true,
    "gate_owner_approved": true,
    "repository_owner_approved": true
  },
  "source_documents": {
    "phase5_enablement": "schemas/phase5-enablement.schema.json",
    "l4_production_acceptance": "docs/L4-PRODUCTION-ACCEPTANCE.md",
    "gate_enablement_boundary": "docs/GATE-PRODUCTION-ENABLEMENT-BOUNDARY.md"
  },
  "created_at": "2026-06-27T00:00:00.000Z"
}
